{
  "$schema": "http://json-schema.org/draft-07/schema#",
  "$id": "https://schemas.stacspec.org/v1.0.0/collection-spec/json-schema/collection.json",
  "title": "STAC Collection (self-contained for testing)",
  "description": "Simplified self-contained STAC Collection schema for offline validation. Based on STAC v1.0.0 spec, without external $ref dependencies.",
  "type": "object",
  "required": [
    "stac_version",
    "type",
    "id",
    "description",
    "license",
    "extent",
    "links"
  ],
  "properties": {
    "stac_version": {
      "title": "STAC version",
      "type": "string",
      "pattern": "^1\\."
    },
    "stac_extensions": {
      "title": "STAC extensions",
      "type": "array",
      "uniqueItems": true,
      "items": {
        "type": "string",
        "minLength": 1
      }
    },
    "type": {
      "title": "Collection type",
      "const": "Collection"
    },
    "id": {
      "title": "Collection ID",
      "type": "string",
      "minLength": 1
    },
    "title": {
      "type": "string"
    },
    "description": {
      "title": "Collection description",
      "type": "string",
      "minLength": 1
    },
    "license": {
      "title": "License",
      "type": "string",
      "minLength": 1
    },
    "keywords": {
      "type": "array",
      "items": { "type": "string" }
    },
    "providers": {
      "type": "array",
      "items": {
        "$ref": "#/definitions/provider"
      }
    },
    "extent": {
      "title": "Extent",
      "$ref": "#/definitions/extent"
    },
    "summaries": {
      "title": "Summaries",
      "type": "object"
    },
    "assets": {
      "type": "object"
    },
    "links": {
      "title": "Links",
      "type": "array",
      "items": {
        "$ref": "#/definitions/link"
      }
    }
  },
  "definitions": {
    "extent": {
      "type": "object",
      "required": ["spatial", "temporal"],
      "properties": {
        "spatial": {
          "type": "object",
          "required": ["bbox"],
          "properties": {
            "bbox": {
              "type": "array",
              "minItems": 1,
              "items": {
                "type": "array",
                "oneOf": [
                  { "minItems": 4, "maxItems": 4 },
                  { "minItems": 6, "maxItems": 6 }
                ],
                "items": { "type": "number" }
              }
            }
          }
        },
        "temporal": {
          "type": "object",
          "required": ["interval"],
          "properties": {
            "interval": {
              "type": "array",
              "minItems": 1,
              "items": {
                "type": "array",
                "minItems": 2,
                "maxItems": 2,
                "items": {
                  "type": ["string", "null"]
                }
              }
            }
          }
        }
      }
    },
    "provider": {
      "type": "object",
      "required": ["name"],
      "properties": {
        "name": { "type": "string" },
        "description": { "type": "string" },
        "roles": {
          "type": "array",
          "items": { "type": "string" }
        },
        "url": {
          "type": "string"
        }
      }
    },
    "link": {
      "type": "object",
      "required": ["rel", "href"],
      "properties": {
        "rel": {
          "type": "string",
          "minLength": 1
        },
        "href": {
          "type": "string",
          "minLength": 1
        },
        "type": {
          "type": "string"
        },
        "title": {
          "type": "string"
        }
      }
    }
  }
}
